{
  "schema_version": "1.0",
  "config_id": "four_stalls.v0",
  "module_id": "four_stalls",
  "kind": "micro",
  "pathways": ["B"],
  "version": "0.1.0",
  "paradigms": ["igt_lite"],
  "constructs": [
    "decisiveness",
    "persistence_of_style",
    "response_consistency",
    "risk_preference",
    "stability"
  ],
  "indicators": [
    "decisiveness.time_to_commit",
    "persistence_of_style.cross_segment_style_r",
    "persistence_of_style.lag1_autocorr",
    "response_consistency.choice_entropy_repeats",
    "response_consistency.loc_scale_sigma",
    "risk_preference.high_variance_stall_share",
    "stability.shift_slope"
  ],
  "slot": true,
  "scorable": true,
  "budget": {
    "intro_ms": 7000,
    "outro_ms": 2500,
    "target_ms_l2": 87100,
    "soft_cap_ms": 93000,
    "hard_cap_ms": 94000
  },
  "levels": {
    "L1": {
      "timing": {
        "choice_window_ms": 5000,
        "payoff_ms": 900,
        "errand_ms": 900,
        "iti_ms": 350,
        "probe_window_ms": 6000
      },
      "seconds_per_trial": {
        "median": 2.95,
        "slow": 3.15
      },
      "estimated_duration_ms": {
        "median": 90700,
        "slow": 95500,
        "slow_trimmed": 89200
      }
    },
    "L2": {
      "timing": {
        "choice_window_ms": 4500,
        "payoff_ms": 800,
        "errand_ms": 900,
        "iti_ms": 350,
        "probe_window_ms": 5500
      },
      "seconds_per_trial": {
        "median": 2.8,
        "slow": 3.0
      },
      "estimated_duration_ms": {
        "median": 87100,
        "slow": 91900,
        "slow_trimmed": 85900
      }
    },
    "L3": {
      "timing": {
        "choice_window_ms": 4000,
        "payoff_ms": 700,
        "errand_ms": 900,
        "iti_ms": 350,
        "probe_window_ms": 5000
      },
      "seconds_per_trial": {
        "median": 2.7,
        "slow": 2.9
      },
      "estimated_duration_ms": {
        "median": 84700,
        "slow": 89500,
        "slow_trimmed": 83700
      }
    }
  },
  "blocks": [
    {
      "block_id": "practice",
      "phase": "practice",
      "condition_id": "standard",
      "trials": 2,
      "min_trials": 2,
      "budget_trial_ms": null,
      "scorable": false,
      "conditions": {
        "timer": false,
        "noise": false,
        "shift_active": false
      },
      "beats": []
    },
    {
      "block_id": "choices",
      "phase": "main",
      "condition_id": "standard",
      "trials": 22,
      "min_trials": 20,
      "budget_trial_ms": null,
      "scorable": true,
      "conditions": {
        "timer": false,
        "noise": false,
        "shift_active": false
      },
      "beats": ["repeat_probe"]
    },
    {
      "block_id": "probe",
      "phase": "main",
      "condition_id": "probe",
      "trials": 4,
      "min_trials": 4,
      "budget_trial_ms": 2600,
      "scorable": true,
      "conditions": {
        "timer": false,
        "noise": false,
        "shift_active": false
      },
      "beats": ["probe_segment"]
    }
  ],
  "min_counts": {
    "choices": 20,
    "repeat_probes": 10
  },
  "planned_counts": {
    "choices": 22,
    "repeat_probes": 12
  },
  "constraints": {
    "stalls": 4,
    "high_variance_stalls": 2,
    "pictorial_payoffs": true,
    "high_variance_assignment": "seeded",
    "low_variance_gain": [1, 2],
    "low_variance_loss": [1, 1],
    "low_variance_loss_rate": 0.2,
    "high_variance_gain": [3, 4],
    "high_variance_loss": [6, 8],
    "high_variance_loss_rate": 0.4,
    "repeat_groups": 4,
    "repeat_presentations": 3,
    "probe_safe_counts": [2, 3, 4, 3],
    "probe_risky_sides": ["right", "left", "right", "left"]
  },
  "context_shift": null,
  "forms": ["form_1", "form_2"],
  "audio_keys": [
    "four_stalls.intro",
    "four_stalls.practice",
    "four_stalls.outro",
    "four_stalls.replay"
  ],
  "requires_numeracy": false,
  "notes": "Slot module. Four vendor stalls with seeded pictorial payoffs and repeated identical situations (MG-09). seconds_per_trial include the errand arrivals (12 of 22 choices are repeated errands)."
}
