{
  "schema_version": "1.0",
  "config_id": "coplay.v0",
  "module_id": "coplay",
  "kind": "episode",
  "pathways": ["A"],
  "version": "0.1.0",
  "paradigms": ["coplay", "public_goods", "credit_allocation"],
  "constructs": ["teamwork"],
  "indicators": ["teamwork.coplay_credit_share", "teamwork.interruptions", "teamwork.turn_waiting"],
  "slot": false,
  "scorable": true,
  "budget": {
    "intro_ms": 10000,
    "outro_ms": 3000,
    "target_ms_l2": 201000,
    "soft_cap_ms": 280000,
    "hard_cap_ms": 300000
  },
  "levels": {
    "L1": {
      "timing": {
        "turn_window_ms": 9000
      },
      "seconds_per_trial": {
        "median": 6.4,
        "slow": 7.0
      },
      "estimated_duration_ms": {
        "median": 212200,
        "slow": 229000,
        "slow_trimmed": 187000
      }
    },
    "L2": {
      "timing": {
        "turn_window_ms": 8000
      },
      "seconds_per_trial": {
        "median": 6.0,
        "slow": 6.8
      },
      "estimated_duration_ms": {
        "median": 201000,
        "slow": 223400,
        "slow_trimmed": 182600
      }
    },
    "L3": {
      "timing": {
        "turn_window_ms": 7000
      },
      "seconds_per_trial": {
        "median": 5.6,
        "slow": 6.4
      },
      "estimated_duration_ms": {
        "median": 189800,
        "slow": 212200,
        "slow_trimmed": 173800
      }
    }
  },
  "blocks": [
    {
      "block_id": "practice",
      "phase": "practice",
      "condition_id": "standard",
      "trials": 2,
      "min_trials": 2,
      "budget_trial_ms": 5000,
      "scorable": false,
      "conditions": {
        "timer": false,
        "noise": false,
        "shift_active": false
      },
      "beats": []
    },
    {
      "block_id": "turns",
      "phase": "main",
      "condition_id": "live_dyad",
      "trials": 24,
      "min_trials": 20,
      "budget_trial_ms": null,
      "scorable": true,
      "conditions": {
        "timer": false,
        "noise": false,
        "shift_active": false
      },
      "beats": ["turn_taking", "contribution"]
    },
    {
      "block_id": "credit_round",
      "phase": "main",
      "condition_id": "credit_round",
      "trials": 4,
      "min_trials": 2,
      "budget_trial_ms": null,
      "scorable": true,
      "conditions": {
        "timer": false,
        "noise": false,
        "shift_active": false
      },
      "beats": ["credit_allocation"]
    },
    {
      "block_id": "partner_rating_handoff",
      "phase": "main",
      "condition_id": "rating_handoff",
      "trials": 1,
      "min_trials": 1,
      "budget_trial_ms": 10000,
      "scorable": true,
      "conditions": {
        "timer": false,
        "noise": false,
        "shift_active": false
      },
      "beats": ["look_away"]
    }
  ],
  "min_counts": {
    "turns": 16,
    "credit_rounds": 2
  },
  "planned_counts": {
    "turns": 24,
    "credit_rounds": 4
  },
  "constraints": {
    "site_mode_required": "supervised",
    "split_screen": true,
    "separate_consent_per_player": true
  },
  "context_shift": null,
  "forms": ["form_1"],
  "audio_keys": ["coplay.intro", "coplay.practice", "coplay.outro", "coplay.replay"],
  "requires_numeracy": false,
  "notes": "Pathway D live-dyad substudy: optional 4th episode, supervised sites only, sessions extended to <= 20 min under substudy consent (EPI-06). Not part of the 15-minute budget."
}
