{
  "schema_version": "1.0",
  "config_id": "weighing_post.v0",
  "module_id": "weighing_post",
  "kind": "episode",
  "pathways": ["A"],
  "version": "0.1.0",
  "paradigms": ["weighing_decision", "dilemma", "private_report", "rule_change"],
  "constructs": [
    "adaptability",
    "decisiveness",
    "integrity",
    "judgement",
    "persistence_of_style",
    "response_consistency",
    "risk_preference",
    "stability"
  ],
  "indicators": [
    "adaptability.rule_compliance_post_shift",
    "decisiveness.commit_rvi",
    "decisiveness.info_gathered",
    "decisiveness.reversals_before_confirm",
    "decisiveness.time_to_commit",
    "integrity.bribe_acceptance",
    "integrity.luck_token_overreport_rate",
    "integrity.overpayment_return",
    "judgement.blame_shifting",
    "judgement.consistency_across_dilemmas",
    "judgement.credit_taking",
    "persistence_of_style.cross_segment_style_r",
    "persistence_of_style.lag1_autocorr",
    "response_consistency.choice_entropy_repeats",
    "response_consistency.loc_scale_sigma",
    "risk_preference.gamble_rate",
    "stability.shift_slope",
    "stability.shift_slope_new_rule"
  ],
  "slot": false,
  "scorable": true,
  "budget": {
    "intro_ms": 9000,
    "outro_ms": 3000,
    "target_ms_l2": 192400,
    "soft_cap_ms": 194000,
    "hard_cap_ms": 196000
  },
  "levels": {
    "L1": {
      "timing": {
        "decision_window_ms": 9000,
        "needle_settle_ms": 1400,
        "dilemma_window_ms": 10000
      },
      "seconds_per_trial": {
        "median": 5.45,
        "slow": 5.6
      },
      "estimated_duration_ms": {
        "median": 193850,
        "slow": 198200,
        "slow_trimmed": 187000
      }
    },
    "L2": {
      "timing": {
        "decision_window_ms": 8000,
        "needle_settle_ms": 1200,
        "dilemma_window_ms": 9000
      },
      "seconds_per_trial": {
        "median": 5.4,
        "slow": 5.55
      },
      "estimated_duration_ms": {
        "median": 192400,
        "slow": 196750,
        "slow_trimmed": 185650
      }
    },
    "L3": {
      "timing": {
        "decision_window_ms": 7000,
        "needle_settle_ms": 1000,
        "dilemma_window_ms": 8000
      },
      "seconds_per_trial": {
        "median": 5.1,
        "slow": 5.4
      },
      "estimated_duration_ms": {
        "median": 183700,
        "slow": 192400,
        "slow_trimmed": 181600
      }
    }
  },
  "blocks": [
    {
      "block_id": "practice",
      "phase": "practice",
      "condition_id": "standard",
      "trials": 1,
      "min_trials": 1,
      "budget_trial_ms": 5000,
      "scorable": false,
      "conditions": {
        "timer": false,
        "noise": false,
        "shift_active": false
      },
      "beats": []
    },
    {
      "block_id": "decisions_pre",
      "phase": "shift_pre",
      "condition_id": "standard",
      "trials": 7,
      "min_trials": 6,
      "budget_trial_ms": null,
      "scorable": true,
      "conditions": {
        "timer": false,
        "noise": false,
        "shift_active": false
      },
      "beats": ["weigh", "inspect_more"]
    },
    {
      "block_id": "dilemmas",
      "phase": "main",
      "condition_id": "dilemmas",
      "trials": 12,
      "min_trials": 12,
      "budget_trial_ms": null,
      "scorable": true,
      "conditions": {
        "timer": false,
        "noise": false,
        "shift_active": false
      },
      "beats": ["bribe", "overpayment", "assistant_mistake", "fraud_found"]
    },
    {
      "block_id": "gamble",
      "phase": "main",
      "condition_id": "gamble_inspection",
      "trials": 3,
      "min_trials": 3,
      "budget_trial_ms": null,
      "scorable": true,
      "conditions": {
        "timer": false,
        "noise": false,
        "shift_active": false
      },
      "beats": ["gamble_inspection"]
    },
    {
      "block_id": "luck_tokens",
      "phase": "main",
      "condition_id": "private_report",
      "trials": 4,
      "min_trials": 4,
      "budget_trial_ms": 3500,
      "scorable": true,
      "conditions": {
        "timer": false,
        "noise": false,
        "shift_active": false
      },
      "beats": ["luck_token"]
    },
    {
      "block_id": "decisions_post",
      "phase": "shift_post",
      "condition_id": "new_rule",
      "trials": 7,
      "min_trials": 6,
      "budget_trial_ms": null,
      "scorable": true,
      "conditions": {
        "timer": false,
        "noise": false,
        "shift_active": true
      },
      "beats": ["weigh", "new_rule"]
    },
    {
      "block_id": "probe",
      "phase": "main",
      "condition_id": "probe",
      "trials": 4,
      "min_trials": 4,
      "budget_trial_ms": 1200,
      "scorable": true,
      "conditions": {
        "timer": false,
        "noise": false,
        "shift_active": false
      },
      "beats": ["probe_segment"]
    }
  ],
  "min_counts": {
    "decisions": 12,
    "post_shift": 6,
    "bribe": 3,
    "overpayment": 3,
    "assistant_mistake": 3,
    "fraud_found": 3
  },
  "planned_counts": {
    "decisions": 14,
    "post_shift": 7,
    "bribe": 3,
    "overpayment": 3,
    "assistant_mistake": 3,
    "fraud_found": 3
  },
  "constraints": {
    "quantities_shown_as": "needle_and_pans",
    "spoken_quantities": true,
    "bribe_size_as_pictured_quantity": true,
    "luck_tokens_group_only": true
  },
  "context_shift": {
    "kind": "new_market_rule",
    "announced": true,
    "window": [26, 30]
  },
  "forms": ["form_1", "form_2"],
  "audio_keys": [
    "weighing_post.intro",
    "weighing_post.practice",
    "weighing_post.outro",
    "weighing_post.replay",
    "weighing_post.new_rule",
    "weighing_post.quantity_prefix"
  ],
  "requires_numeracy": false,
  "notes": "Episode 2, Weighmaster (EPI-02). Decisions approve/warn/fine with inspect more; >= 3 dilemmas per type; requires_numeracy false on every decision."
}
