{
  "schema_version": "1.0",
  "config_id": "wait_or_now.v0",
  "module_id": "wait_or_now",
  "kind": "micro",
  "pathways": ["B"],
  "version": "0.1.0",
  "paradigms": ["delay_discounting", "effort_discounting"],
  "constructs": [
    "persistence",
    "persistence_of_style",
    "response_consistency",
    "self_control",
    "stability"
  ],
  "indicators": [
    "persistence.effort_completion_rate",
    "persistence_of_style.cross_segment_style_r",
    "persistence_of_style.lag1_autocorr",
    "response_consistency.loc_scale_sigma",
    "self_control.choice_consistency",
    "self_control.delay_discount_logk",
    "self_control.effort_discount",
    "stability.shift_slope"
  ],
  "slot": true,
  "scorable": true,
  "budget": {
    "intro_ms": 6000,
    "outro_ms": 1500,
    "target_ms_l2": 77300,
    "soft_cap_ms": 85000,
    "hard_cap_ms": 86000
  },
  "levels": {
    "L1": {
      "timing": {
        "choice_window_ms": 8000,
        "hold_required_ms": 2000
      },
      "seconds_per_trial": {
        "median": 5.2,
        "slow": 5.6
      },
      "estimated_duration_ms": {
        "median": 79700,
        "slow": 84500,
        "slow_trimmed": 84500
      }
    },
    "L2": {
      "timing": {
        "choice_window_ms": 7000,
        "hold_required_ms": 2500
      },
      "seconds_per_trial": {
        "median": 5.0,
        "slow": 5.4
      },
      "estimated_duration_ms": {
        "median": 77300,
        "slow": 82100,
        "slow_trimmed": 82100
      }
    },
    "L3": {
      "timing": {
        "choice_window_ms": 6000,
        "hold_required_ms": 3000
      },
      "seconds_per_trial": {
        "median": 4.8,
        "slow": 5.2
      },
      "estimated_duration_ms": {
        "median": 74900,
        "slow": 79700,
        "slow_trimmed": 79700
      }
    }
  },
  "blocks": [
    {
      "block_id": "practice",
      "phase": "practice",
      "condition_id": "standard",
      "trials": 1,
      "min_trials": 1,
      "budget_trial_ms": 5000,
      "scorable": false,
      "conditions": {
        "timer": false,
        "noise": false,
        "shift_active": false
      },
      "beats": []
    },
    {
      "block_id": "delay",
      "phase": "main",
      "condition_id": "delay",
      "trials": 8,
      "min_trials": 8,
      "budget_trial_ms": null,
      "scorable": true,
      "conditions": {
        "timer": false,
        "noise": false,
        "shift_active": false
      },
      "beats": ["sun_moon_delay"]
    },
    {
      "block_id": "effort",
      "phase": "main",
      "condition_id": "effort",
      "trials": 4,
      "min_trials": 4,
      "budget_trial_ms": null,
      "scorable": true,
      "conditions": {
        "timer": false,
        "noise": false,
        "shift_active": false
      },
      "beats": ["hold_to_earn"]
    },
    {
      "block_id": "probe",
      "phase": "main",
      "condition_id": "probe",
      "trials": 4,
      "min_trials": 4,
      "budget_trial_ms": 1200,
      "scorable": true,
      "conditions": {
        "timer": false,
        "noise": false,
        "shift_active": false
      },
      "beats": ["probe_segment"]
    }
  ],
  "min_counts": {
    "choices": 12,
    "effort_choices": 4
  },
  "planned_counts": {
    "choices": 12,
    "effort_choices": 4
  },
  "constraints": {
    "titration": "seeded_bisection",
    "delay_units": "sun_moon_cycles"
  },
  "context_shift": null,
  "forms": ["form_1", "form_2"],
  "audio_keys": [
    "wait_or_now.intro",
    "wait_or_now.practice",
    "wait_or_now.outro",
    "wait_or_now.replay"
  ],
  "requires_numeracy": false,
  "notes": "Slot module (planned missingness). Delay as sun/moon cycles, effort as hold-to-earn (MG-07)."
}
