{
  "schema_version": "1.0",
  "config_id": "steady_hands.v0",
  "module_id": "steady_hands",
  "kind": "micro",
  "pathways": ["B"],
  "version": "0.1.0",
  "paradigms": ["held_vs_free_responding"],
  "constructs": [
    "composure",
    "expressive_restraint",
    "persistence_of_style",
    "response_consistency",
    "stability"
  ],
  "indicators": [
    "composure.distractor_slope",
    "expressive_restraint.held_vs_free_slope",
    "persistence_of_style.cross_segment_style_r",
    "persistence_of_style.lag1_autocorr",
    "response_consistency.loc_scale_sigma",
    "stability.shift_slope"
  ],
  "slot": true,
  "scorable": true,
  "budget": {
    "intro_ms": 9000,
    "outro_ms": 2500,
    "target_ms_l2": 84540,
    "soft_cap_ms": 93000,
    "hard_cap_ms": 94000
  },
  "levels": {
    "L1": {
      "timing": {
        "target_ms": 700,
        "isi_ms": 480,
        "distractor_ms": 300,
        "block_intro_ms": 1800,
        "hold_wait_ms": 4000,
        "probe_window_ms": 6000
      },
      "seconds_per_trial": {
        "median": 1.22,
        "slow": 1.24
      },
      "estimated_duration_ms": {
        "median": 92660,
        "slow": 93820,
        "slow_trimmed": 88860
      }
    },
    "L2": {
      "timing": {
        "target_ms": 600,
        "isi_ms": 440,
        "distractor_ms": 250,
        "block_intro_ms": 1800,
        "hold_wait_ms": 4000,
        "probe_window_ms": 5500
      },
      "seconds_per_trial": {
        "median": 1.08,
        "slow": 1.1
      },
      "estimated_duration_ms": {
        "median": 84540,
        "slow": 85700,
        "slow_trimmed": 81300
      }
    },
    "L3": {
      "timing": {
        "target_ms": 520,
        "isi_ms": 400,
        "distractor_ms": 200,
        "block_intro_ms": 1800,
        "hold_wait_ms": 4000,
        "probe_window_ms": 5000
      },
      "seconds_per_trial": {
        "median": 0.96,
        "slow": 0.98
      },
      "estimated_duration_ms": {
        "median": 77580,
        "slow": 78740,
        "slow_trimmed": 74820
      }
    }
  },
  "blocks": [
    {
      "block_id": "practice",
      "phase": "practice",
      "condition_id": "standard",
      "trials": 2,
      "min_trials": 2,
      "budget_trial_ms": null,
      "scorable": false,
      "conditions": {
        "timer": false,
        "noise": false,
        "shift_active": false
      },
      "beats": []
    },
    {
      "block_id": "free",
      "phase": "main",
      "condition_id": "free",
      "trials": 28,
      "min_trials": 26,
      "budget_trial_ms": null,
      "scorable": true,
      "conditions": {
        "timer": false,
        "noise": false,
        "shift_active": false
      },
      "beats": ["distractor"]
    },
    {
      "block_id": "held",
      "phase": "main",
      "condition_id": "held",
      "trials": 28,
      "min_trials": 26,
      "budget_trial_ms": null,
      "scorable": true,
      "conditions": {
        "timer": false,
        "noise": false,
        "shift_active": true
      },
      "beats": ["distractor", "hold"]
    },
    {
      "block_id": "probe",
      "phase": "main",
      "condition_id": "probe",
      "trials": 4,
      "min_trials": 4,
      "budget_trial_ms": 2600,
      "scorable": true,
      "conditions": {
        "timer": false,
        "noise": false,
        "shift_active": false
      },
      "beats": ["probe_segment"]
    }
  ],
  "min_counts": {
    "free": 26,
    "held": 26
  },
  "planned_counts": {
    "free": 28,
    "held": 28
  },
  "constraints": {
    "counterbalanced_block_order": true,
    "distractor_share": 0.3,
    "fixed_paced": true,
    "distractor_kinds": ["firework", "sky_lantern", "bell"],
    "probe_safe_counts": [2, 3, 4, 3],
    "probe_risky_sides": ["right", "left", "right", "left"]
  },
  "context_shift": {
    "kind": "held_block",
    "announced": true,
    "window": [30, 30]
  },
  "forms": ["form_1", "form_2"],
  "audio_keys": [
    "steady_hands.intro",
    "steady_hands.practice",
    "steady_hands.outro",
    "steady_hands.replay"
  ],
  "requires_numeracy": false,
  "notes": "Slot module. Counterbalanced free and held blocks with distractors (MG-08). intro_ms includes the two announced block switches (block_intro_ms each); a trial is ISI + target window."
}
