{
  "schema_version": "1.0",
  "config_id": "warmup.v0",
  "module_id": "warmup",
  "kind": "warmup",
  "pathways": ["A", "B"],
  "version": "0.1.0",
  "paradigms": ["practice", "calibration"],
  "constructs": [],
  "indicators": [],
  "slot": false,
  "scorable": false,
  "budget": {
    "intro_ms": 4000,
    "outro_ms": 1000,
    "target_ms_l2": 46600,
    "soft_cap_ms": 56000,
    "hard_cap_ms": 60000
  },
  "levels": {
    "L1": {
      "timing": {
        "tap_window_ms": 2500,
        "hold_required_ms": 1200
      },
      "seconds_per_trial": {
        "median": 2.6,
        "slow": 3.4
      },
      "estimated_duration_ms": {
        "median": 46600,
        "slow": 59400,
        "slow_trimmed": 39000
      }
    },
    "L2": {
      "timing": {
        "tap_window_ms": 2500,
        "hold_required_ms": 1200
      },
      "seconds_per_trial": {
        "median": 2.6,
        "slow": 3.4
      },
      "estimated_duration_ms": {
        "median": 46600,
        "slow": 59400,
        "slow_trimmed": 39000
      }
    },
    "L3": {
      "timing": {
        "tap_window_ms": 2500,
        "hold_required_ms": 1200
      },
      "seconds_per_trial": {
        "median": 2.6,
        "slow": 3.4
      },
      "estimated_duration_ms": {
        "median": 46600,
        "slow": 59400,
        "slow_trimmed": 39000
      }
    }
  },
  "blocks": [
    {
      "block_id": "tap",
      "phase": "warmup",
      "condition_id": "tap",
      "trials": 4,
      "min_trials": 2,
      "budget_trial_ms": null,
      "scorable": false,
      "conditions": {
        "timer": false,
        "noise": false,
        "shift_active": false
      },
      "beats": ["tap"]
    },
    {
      "block_id": "hold",
      "phase": "warmup",
      "condition_id": "hold",
      "trials": 4,
      "min_trials": 2,
      "budget_trial_ms": null,
      "scorable": false,
      "conditions": {
        "timer": false,
        "noise": false,
        "shift_active": false
      },
      "beats": ["hold"]
    },
    {
      "block_id": "choice",
      "phase": "warmup",
      "condition_id": "choice",
      "trials": 4,
      "min_trials": 2,
      "budget_trial_ms": null,
      "scorable": false,
      "conditions": {
        "timer": false,
        "noise": false,
        "shift_active": false
      },
      "beats": ["choice"]
    },
    {
      "block_id": "calibration",
      "phase": "warmup",
      "condition_id": "calibration",
      "trials": 4,
      "min_trials": 4,
      "budget_trial_ms": null,
      "scorable": false,
      "conditions": {
        "timer": false,
        "noise": false,
        "shift_active": false
      },
      "beats": ["rt_probe"]
    }
  ],
  "min_counts": {
    "passes_per_skill": 2,
    "max_attempts_per_skill": 4
  },
  "planned_counts": {
    "passes_per_skill": 2,
    "max_attempts_per_skill": 4
  },
  "constraints": {
    "calibration_policy_default": "fixed_L2_with_L1_fallback",
    "practice_struggle_sets_l1": true
  },
  "context_shift": null,
  "forms": ["form_1"],
  "audio_keys": ["warmup.intro", "warmup.tap", "warmup.hold", "warmup.choice", "warmup.done"],
  "requires_numeracy": false,
  "notes": "Practice merged with warm-up (ONB-05, ENG-10); never scorable. Levels share timing because calibration happens here."
}
