{
  "schema_version": "1.0",
  "config_id": "balloon.v0",
  "module_id": "balloon",
  "kind": "micro",
  "pathways": ["B"],
  "version": "0.1.0",
  "paradigms": ["bart"],
  "constructs": [
    "decisiveness",
    "persistence_of_style",
    "response_consistency",
    "risk_preference",
    "stability"
  ],
  "indicators": [
    "decisiveness.commit_rvi",
    "decisiveness.time_to_collect",
    "persistence_of_style.cross_segment_style_r",
    "persistence_of_style.lag1_autocorr",
    "persistence_of_style.post_loss_adjustment",
    "response_consistency.loc_scale_sigma",
    "response_consistency.pump_rvi",
    "risk_preference.adjusted_pumps",
    "risk_preference.explosion_rate",
    "stability.shift_slope"
  ],
  "slot": false,
  "scorable": true,
  "budget": {
    "intro_ms": 5000,
    "outro_ms": 1500,
    "target_ms_l2": 93750,
    "soft_cap_ms": 99000,
    "hard_cap_ms": 100000
  },
  "levels": {
    "L1": {
      "timing": {
        "pump_animation_ms": 260,
        "explosion_feedback_ms": 900,
        "bank_feedback_ms": 700,
        "max_pumps": 32
      },
      "seconds_per_trial": {
        "median": 5.1,
        "slow": 5.4
      },
      "estimated_duration_ms": {
        "median": 98000,
        "slow": 103100,
        "slow_trimmed": 97700
      }
    },
    "L2": {
      "timing": {
        "pump_animation_ms": 220,
        "explosion_feedback_ms": 800,
        "bank_feedback_ms": 600,
        "max_pumps": 32
      },
      "seconds_per_trial": {
        "median": 4.85,
        "slow": 5.2
      },
      "estimated_duration_ms": {
        "median": 93750,
        "slow": 99700,
        "slow_trimmed": 94500
      }
    },
    "L3": {
      "timing": {
        "pump_animation_ms": 200,
        "explosion_feedback_ms": 700,
        "bank_feedback_ms": 500,
        "max_pumps": 32
      },
      "seconds_per_trial": {
        "median": 4.6,
        "slow": 5.0
      },
      "estimated_duration_ms": {
        "median": 89500,
        "slow": 96300,
        "slow_trimmed": 91300
      }
    }
  },
  "blocks": [
    {
      "block_id": "practice",
      "phase": "practice",
      "condition_id": "standard",
      "trials": 1,
      "min_trials": 1,
      "budget_trial_ms": null,
      "scorable": false,
      "conditions": {
        "timer": false,
        "noise": false,
        "shift_active": false
      },
      "beats": []
    },
    {
      "block_id": "balloons",
      "phase": "main",
      "condition_id": "standard",
      "trials": 16,
      "min_trials": 15,
      "budget_trial_ms": null,
      "scorable": true,
      "conditions": {
        "timer": false,
        "noise": false,
        "shift_active": false
      },
      "beats": ["low_risk", "high_risk"]
    },
    {
      "block_id": "probe",
      "phase": "main",
      "condition_id": "probe",
      "trials": 4,
      "min_trials": 4,
      "budget_trial_ms": 1200,
      "scorable": true,
      "conditions": {
        "timer": false,
        "noise": false,
        "shift_active": false
      },
      "beats": ["probe_segment"]
    }
  ],
  "min_counts": {
    "balloons": 15,
    "non_exploded": 10
  },
  "planned_counts": {
    "balloons": 16,
    "non_exploded": 11
  },
  "constraints": {
    "risk_colours": 2,
    "explosion_distribution": "uniform_1_to_max_by_colour",
    "seeded_explosion_table": true
  },
  "context_shift": null,
  "forms": ["form_1", "form_2"],
  "audio_keys": ["balloon.intro", "balloon.practice", "balloon.outro", "balloon.replay"],
  "requires_numeracy": false,
  "notes": "Tap to pump, collect to bank (a jar fills; no numbers). Seeded explosion points (MG-01)."
}
