{
  "schema_version": "1.0",
  "config_id": "share_pot.v0",
  "module_id": "share_pot",
  "kind": "micro",
  "pathways": ["B"],
  "version": "0.1.0",
  "paradigms": ["public_goods"],
  "constructs": [
    "decisiveness",
    "emotional_regulation",
    "initiative",
    "persistence_of_style",
    "response_consistency",
    "stability",
    "teamwork"
  ],
  "indicators": [
    "decisiveness.reversals_before_confirm",
    "emotional_regulation.tone_after_unfair_loss_b",
    "initiative.unprompted_share",
    "persistence_of_style.cross_segment_style_r",
    "persistence_of_style.lag1_autocorr",
    "response_consistency.loc_scale_sigma",
    "stability.shift_slope",
    "teamwork.mean_contribution",
    "teamwork.response_to_partner_defection",
    "teamwork.response_to_partner_error"
  ],
  "slot": false,
  "scorable": true,
  "budget": {
    "intro_ms": 8000,
    "outro_ms": 2500,
    "target_ms_l2": 91500,
    "soft_cap_ms": 94000,
    "hard_cap_ms": 96000
  },
  "levels": {
    "L1": {
      "timing": {
        "decision_window_ms": 9000,
        "reveal_ms": 1600,
        "deal_ms": 700,
        "prompt_delay_ms": 2500,
        "round_gap_ms": 400,
        "grab_ms": 1600,
        "tone_window_ms": 6500,
        "probe_window_ms": 6000
      },
      "seconds_per_trial": {
        "median": 7.4,
        "slow": 7.7
      },
      "estimated_duration_ms": {
        "median": 93100,
        "slow": 95500,
        "slow_trimmed": 95500
      }
    },
    "L2": {
      "timing": {
        "decision_window_ms": 8000,
        "reveal_ms": 1400,
        "deal_ms": 700,
        "prompt_delay_ms": 2500,
        "round_gap_ms": 400,
        "grab_ms": 1600,
        "tone_window_ms": 6000,
        "probe_window_ms": 5500
      },
      "seconds_per_trial": {
        "median": 7.2,
        "slow": 7.7
      },
      "estimated_duration_ms": {
        "median": 91500,
        "slow": 95500,
        "slow_trimmed": 95500
      }
    },
    "L3": {
      "timing": {
        "decision_window_ms": 7000,
        "reveal_ms": 1200,
        "deal_ms": 700,
        "prompt_delay_ms": 2500,
        "round_gap_ms": 400,
        "grab_ms": 1600,
        "tone_window_ms": 5500,
        "probe_window_ms": 5000
      },
      "seconds_per_trial": {
        "median": 7.0,
        "slow": 7.5
      },
      "estimated_duration_ms": {
        "median": 89900,
        "slow": 93900,
        "slow_trimmed": 93900
      }
    }
  },
  "blocks": [
    {
      "block_id": "practice",
      "phase": "practice",
      "condition_id": "standard",
      "trials": 1,
      "min_trials": 1,
      "budget_trial_ms": 7000,
      "scorable": false,
      "conditions": {
        "timer": false,
        "noise": false,
        "shift_active": false
      },
      "beats": []
    },
    {
      "block_id": "rounds",
      "phase": "main",
      "condition_id": "scripted_partners",
      "trials": 8,
      "min_trials": 8,
      "budget_trial_ms": null,
      "scorable": true,
      "conditions": {
        "timer": false,
        "noise": false,
        "shift_active": false
      },
      "beats": ["cooperative", "free_rider", "error_round"]
    },
    {
      "block_id": "tone_probe",
      "phase": "main",
      "condition_id": "unfair_loss_probe",
      "trials": 1,
      "min_trials": 1,
      "budget_trial_ms": 6000,
      "scorable": true,
      "conditions": {
        "timer": false,
        "noise": false,
        "shift_active": false
      },
      "beats": ["tone_choice"]
    },
    {
      "block_id": "probe",
      "phase": "main",
      "condition_id": "probe",
      "trials": 4,
      "min_trials": 4,
      "budget_trial_ms": 2600,
      "scorable": true,
      "conditions": {
        "timer": false,
        "noise": false,
        "shift_active": false
      },
      "beats": ["probe_segment"]
    }
  ],
  "min_counts": {
    "rounds": 8,
    "free_rider_rounds": 3,
    "error_rounds": 1
  },
  "planned_counts": {
    "rounds": 8,
    "free_rider_rounds": 3,
    "error_rounds": 1
  },
  "constraints": {
    "endowment_tokens": 10,
    "partner_policies": ["cooperative", "free_rider", "error_prone"],
    "error_round_window": [4, 6],
    "seeded_partners": true,
    "pot_multiplier": 2,
    "free_rider_max_tokens": 1,
    "error_tokens": 0,
    "tone_options": ["warm", "neutral", "firm"],
    "unfair_pot_tokens": 6,
    "last_round_cooperative": true,
    "probe_safe_counts": [2, 3, 4, 3],
    "probe_risky_sides": ["right", "left", "right", "left"]
  },
  "context_shift": {
    "kind": "partner_error",
    "announced": false,
    "window": [4, 6]
  },
  "forms": ["form_1", "form_2"],
  "audio_keys": ["share_pot.intro", "share_pot.practice", "share_pot.outro", "share_pot.replay"],
  "requires_numeracy": false,
  "notes": "8 rounds with pictured tokens and seeded scripted partners (MG-05). Exploratory tone choice after an unfair loss. Budgets measured with the set-2 bot (round = deal + decision + reveal + gap; probe trials are select-then-confirm)."
}
